{
  "$otSharedSchema": "#/pipette/schemas/2/pipetteGeometrySchema.json",
  "nozzleOffset": [0.0, 31.5, 35.52],
  "pipetteBoundingBoxOffsets": {
    "backLeftCorner": [-16.0, 43.15, 35.52],
    "frontRightCorner": [16.0, -43.15, 35.52]
  },
  "pathTo3D": "pipette/definitions/2/geometry/eight_channel/p300/placeholder.gltf",
  "orderedRows": [
    {
      "key": "A",
      "orderedNozzles": ["A1"]
    },
    {
      "key": "B",
      "orderedNozzles": ["B1"]
    },
    { "key": "C", "orderedNozzles": ["C1"] },
    { "key": "D", "orderedNozzles": ["D1"] },
    { "key": "E", "orderedNozzles": ["E1"] },
    { "key": "F", "orderedNozzles": ["F1"] },
    { "key": "G", "orderedNozzles": ["G1"] },
    { "key": "H", "orderedNozzles": ["H1"] }
  ],
  "orderedColumns": [
    {
      "key": "1",
      "orderedNozzles": ["A1", "B1", "C1", "D1", "E1", "F1", "G1", "H1"]
    }
  ],
  "nozzleMap": {
    "A1": [0.0, 31.5, 35.52],
    "B1": [0.0, 22.5, 35.52],
    "C1": [0.0, 13.5, 35.52],
    "D1": [0.0, 4.5, 35.52],
    "E1": [0.0, -4.5, 35.52],
    "F1": [0.0, -13.5, 35.52],
    "G1": [0.0, -22.5, 35.52],
    "H1": [0.0, -31.5, 35.52]
  }
}
