{
  "$otSharedSchema": "#/pipette/schemas/2/pipetteGeometrySchema.json",
  "nozzleOffset": [0.0, 0.0, 50.14],
  "pipetteBoundingBoxOffsets": {
    "backLeftCorner": [0.0, 0.0, 50.14],
    "frontRightCorner": [0.0, 0.0, 50.14]
  },
  "pathTo3D": "pipette/definitions/2/geometry/single_channel/p1000/placeholder.gltf",
  "orderedRows": [{ "key": "A", "orderedNozzles": ["A1"] }],
  "orderedColumns": [{ "key": "1", "orderedNozzles": ["A1"] }],
  "nozzleMap": {
    "A1": [0.0, 0.0, 50.14]
  }
}
